{
  "$schema": "https://json-schema.org/draft/2020-12/schema",
  "$id": "https://weisql.dev/schemas/manifest-v1.schema.json",
  "title": "WeiSQL Manifest V1",
  "type": "object",
  "additionalProperties": false,
  "required": [
    "format",
    "formatVersion",
    "datasetId",
    "tables",
    "vectorCollections"
  ],
  "properties": {
    "format": {
      "const": "weisql"
    },
    "formatVersion": {
      "const": "1.0.0"
    },
    "datasetId": {
      "type": "string",
      "minLength": 1,
      "maxLength": 128,
      "pattern": "^[A-Za-z0-9][A-Za-z0-9._-]*$"
    },
    "tables": {
      "type": "array",
      "maxItems": 10000,
      "items": {
        "$ref": "#/$defs/table"
      }
    },
    "vectorCollections": {
      "type": "array",
      "maxItems": 10000,
      "items": {
        "$ref": "#/$defs/vectorCollection"
      }
    },
    "textIndexes": {
      "type": "array",
      "maxItems": 1000,
      "items": {
        "$ref": "#/$defs/textIndex"
      }
    },
    "metadata": {
      "type": "object",
      "additionalProperties": false,
      "properties": {
        "title": {
          "type": "string"
        },
        "description": {
          "type": "string"
        },
        "createdAt": {
          "type": "string",
          "format": "date-time"
        },
        "builderVersion": {
          "type": "string"
        }
      }
    },
    "signature": {
      "$ref": "#/$defs/signature"
    }
  },
  "$defs": {
    "sha256": {
      "type": "string",
      "pattern": "^[a-fA-F0-9]{64}$"
    },
    "path": {
      "type": "string",
      "minLength": 1,
      "maxLength": 1024,
      "pattern": "^[A-Za-z0-9._/-]+$"
    },
    "file": {
      "type": "object",
      "additionalProperties": false,
      "required": [
        "path",
        "bytes",
        "sha256"
      ],
      "properties": {
        "path": {
          "$ref": "#/$defs/path"
        },
        "bytes": {
          "type": "integer",
          "minimum": 0,
          "maximum": 9007199254740991
        },
        "sha256": {
          "$ref": "#/$defs/sha256"
        }
      }
    },
    "column": {
      "type": "object",
      "additionalProperties": false,
      "required": [
        "name",
        "type",
        "nullable"
      ],
      "properties": {
        "name": {
          "type": "string",
          "maxLength": 128,
          "pattern": "^[A-Za-z_][A-Za-z0-9_]*$"
        },
        "type": {
          "enum": [
            "string",
            "int32",
            "int64",
            "float32",
            "float64",
            "boolean",
            "timestamp",
            "date",
            "json"
          ]
        },
        "nullable": {
          "type": "boolean"
        }
      }
    },
    "table": {
      "type": "object",
      "additionalProperties": false,
      "required": [
        "name",
        "file",
        "format",
        "columns",
        "primaryKey"
      ],
      "properties": {
        "name": {
          "type": "string",
          "maxLength": 128,
          "pattern": "^[A-Za-z_][A-Za-z0-9_]*$"
        },
        "file": {
          "$ref": "#/$defs/file"
        },
        "format": {
          "const": "parquet"
        },
        "columns": {
          "type": "array",
          "minItems": 1,
          "maxItems": 10000,
          "items": {
            "$ref": "#/$defs/column"
          }
        },
        "primaryKey": {
          "type": "array",
          "minItems": 1,
          "uniqueItems": true,
          "items": {
            "type": "string",
            "minLength": 1,
            "maxLength": 128,
            "pattern": "^[A-Za-z_][A-Za-z0-9_]*$"
          }
        }
      }
    },
    "formattedFile": {
      "type": "object",
      "additionalProperties": false,
      "required": [
        "path",
        "bytes",
        "sha256",
        "format"
      ],
      "properties": {
        "path": {
          "$ref": "#/$defs/path"
        },
        "bytes": {
          "type": "integer",
          "minimum": 0,
          "maximum": 9007199254740991
        },
        "sha256": {
          "$ref": "#/$defs/sha256"
        },
        "format": {
          "enum": [
            "jsonl",
            "uint64-le"
          ]
        }
      }
    },
    "idMap": {
      "type": "object",
      "additionalProperties": false,
      "required": [
        "data",
        "offsets",
        "count",
        "uniqueIds"
      ],
      "properties": {
        "data": {
          "$ref": "#/$defs/formattedFile"
        },
        "offsets": {
          "$ref": "#/$defs/formattedFile"
        },
        "count": {
          "type": "integer",
          "minimum": 0,
          "maximum": 9007199254740991
        },
        "uniqueIds": {
          "type": "boolean"
        }
      }
    },
    "textIndex": {
      "type": "object",
      "additionalProperties": false,
      "required": [
        "name",
        "tableName",
        "column",
        "idColumn",
        "documentCount",
        "termCount",
        "averageDocumentLength",
        "data",
        "termOffsets",
        "docLengths",
        "idMap"
      ],
      "properties": {
        "name": {
          "type": "string",
          "maxLength": 128,
          "pattern": "^[A-Za-z_][A-Za-z0-9_]*$"
        },
        "tableName": {
          "type": "string",
          "maxLength": 128,
          "pattern": "^[A-Za-z_][A-Za-z0-9_]*$"
        },
        "column": {
          "type": "string",
          "maxLength": 128,
          "pattern": "^[A-Za-z_][A-Za-z0-9_]*$"
        },
        "idColumn": {
          "type": "string",
          "maxLength": 128,
          "pattern": "^[A-Za-z_][A-Za-z0-9_]*$"
        },
        "documentCount": {
          "type": "integer",
          "minimum": 1,
          "maximum": 9007199254740991
        },
        "termCount": {
          "type": "integer",
          "minimum": 1,
          "maximum": 9007199254740991
        },
        "averageDocumentLength": {
          "type": "number",
          "exclusiveMinimum": 0
        },
        "data": {
          "$ref": "#/$defs/file"
        },
        "termOffsets": {
          "$ref": "#/$defs/file"
        },
        "docLengths": {
          "$ref": "#/$defs/file"
        },
        "idMap": {
          "$ref": "#/$defs/idMap"
        },
        "documents": {
          "type": "object",
          "additionalProperties": false,
          "required": [
            "data",
            "offsets"
          ],
          "properties": {
            "data": {
              "$ref": "#/$defs/formattedFile"
            },
            "offsets": {
              "$ref": "#/$defs/formattedFile"
            }
          }
        },
        "k1": {
          "type": "number",
          "exclusiveMinimum": 0
        },
        "b": {
          "type": "number",
          "minimum": 0,
          "maximum": 1
        }
      }
    },
    "vectorCollection": {
      "type": "object",
      "additionalProperties": false,
      "required": [
        "name",
        "tableName",
        "idColumn",
        "count",
        "dimension",
        "metric",
        "encoding",
        "data",
        "idMap"
      ],
      "properties": {
        "name": {
          "type": "string",
          "maxLength": 128,
          "pattern": "^[A-Za-z_][A-Za-z0-9_]*$"
        },
        "tableName": {
          "type": "string",
          "maxLength": 128,
          "pattern": "^[A-Za-z_][A-Za-z0-9_]*$"
        },
        "idColumn": {
          "type": "string",
          "minLength": 1,
          "maxLength": 128,
          "pattern": "^[A-Za-z_][A-Za-z0-9_]*$"
        },
        "count": {
          "type": "integer",
          "minimum": 0,
          "maximum": 9007199254740991
        },
        "dimension": {
          "type": "integer",
          "minimum": 1,
          "maximum": 65536
        },
        "metric": {
          "enum": [
            "cosine",
            "l2",
            "ip"
          ]
        },
        "encoding": {
          "const": "f32-le-row-major"
        },
        "data": {
          "$ref": "#/$defs/file"
        },
        "idMap": {
          "$ref": "#/$defs/idMap"
        },
        "index": {
          "type": "object",
          "additionalProperties": false,
          "required": [
            "engine",
            "version",
            "file"
          ],
          "properties": {
            "engine": {
              "type": "string",
              "minLength": 1
            },
            "version": {
              "type": "string",
              "minLength": 1
            },
            "file": {
              "$ref": "#/$defs/file"
            },
            "params": {
              "type": "object",
              "maxProperties": 32,
              "propertyNames": {
                "pattern": "^[A-Za-z_][A-Za-z0-9_]*$"
              },
              "additionalProperties": {
                "type": "number"
              }
            }
          }
        }
      }
    },
    "signature": {
      "type": "object",
      "additionalProperties": false,
      "required": [
        "algorithm",
        "keyId",
        "publicKey",
        "value"
      ],
      "properties": {
        "algorithm": {
          "const": "ed25519"
        },
        "keyId": {
          "type": "string",
          "pattern": "^sha256:[a-f0-9]{64}$"
        },
        "publicKey": {
          "type": "string",
          "pattern": "^[A-Za-z0-9+/]+={0,2}$"
        },
        "value": {
          "type": "string",
          "pattern": "^[A-Za-z0-9+/]+={0,2}$"
        }
      }
    }
  }
}
